{
  "contract_version": "0.1.0",
  "tenant_id": "liquisto",
  "area_id": "liquisto",
  "display_name": "Liquisto",
  "legal_profile": {
    "legal_name": "Liquisto Technologies GmbH",
    "registered_address": {
      "street": "Straße",
      "street_number": "60, 3",
      "postal_code": "13158",
      "city": "Berlin",
      "country": "Germany"
    },
    "legal_representatives": [
      {
        "name": "Not stored in public fixture",
        "role": "Tenant Owner"
      }
    ],
    "commercial_register": {
      "register_court": "Not stored in public fixture",
      "registration_number": "Not stored in public fixture"
    },
    "tax": {
      "tax_number": null,
      "vat_id": null,
      "tax_number_sensitivity": "restricted-business-data"
    }
  },
  "contact_profile": {
    "email": "admin@liquisto.com",
    "phone": null,
    "website": "https://liquisto.com"
  },
  "hostnames": [
    {
      "hostname": "liquisto.cloud",
      "purpose": "primary-ui",
      "expected_origin": "145.239.222.45",
      "cloudflare_proxy_expected": true
    }
  ],
  "status": "setup",
  "default_locale": "de-DE",
  "admin_model": {
    "admin_routes": [
      "/admin/users",
      "/admin/roles",
      "/admin/settings"
    ],
    "assignment_model": "users-receive-roles-only",
    "initial_owner": null
  },
  "memory": {
    "area_brain_id": "brain-area-liquisto",
    "shared_promotion_allowed": false
  },
  "knowledge": {
    "scope_id": "knowledge-liquisto",
    "indexes": [
      "knowledge-liquisto-docs"
    ]
  },
  "data_sources": [
    {
      "id": "liquisto-website",
      "tenant_id": "liquisto",
      "type": "website",
      "display_name": "Liquisto Website",
      "access_modes": [
        "read"
      ],
      "status": "planned",
      "sensitivity": "public"
    }
  ],
  "role_bundles": [
    {
      "id": "liquisto-owner",
      "tenant_id": "liquisto",
      "display_name": "Tenant Owner",
      "role_type": "system",
      "assignable_to_users": true,
      "capability_grants": [
        "research",
        "tenant-admin"
      ],
      "data_source_grants": [
        {
          "data_source_id": "liquisto-website",
          "access_modes": [
            "read"
          ]
        }
      ],
      "derived_runtime_modules": {
        "skills": [
          "research-context-synthesis"
        ],
        "workflows": [
          "research-intake",
          "tenant-admin"
        ],
        "tools": [
          "filesystem-list",
          "filesystem-read"
        ],
        "policies": [
          "no-destructive-commands",
          "strict-tenant-isolation",
          "no-cross-area-access",
          "no-cross-tenant-access"
        ],
        "validators": [
          "admin-action-validator",
          "knowledge-scope-validator",
          "no-cross-area-scope-validator",
          "no-cross-tenant-scope-validator",
          "research-output-contract",
          "tenant-profile-validator",
          "user-permission-validator"
        ]
      }
    },
    {
      "id": "liquisto-researcher",
      "tenant_id": "liquisto",
      "display_name": "Researcher",
      "role_type": "tenant-custom",
      "assignable_to_users": true,
      "capability_grants": [
        "research"
      ],
      "data_source_grants": [
        {
          "data_source_id": "liquisto-website",
          "access_modes": [
            "read"
          ]
        }
      ],
      "derived_runtime_modules": {
        "skills": [
          "research-context-synthesis"
        ],
        "workflows": [
          "research-intake"
        ],
        "tools": [
          "filesystem-list",
          "filesystem-read"
        ],
        "policies": [
          "no-destructive-commands",
          "strict-tenant-isolation",
          "no-cross-area-access",
          "no-cross-tenant-access"
        ],
        "validators": [
          "tenant-profile-validator",
          "no-cross-tenant-scope-validator",
          "no-cross-area-scope-validator",
          "knowledge-scope-validator",
          "research-output-contract"
        ]
      }
    }
  ],
  "policy_bundle": [
    "strict-tenant-isolation",
    "no-cross-area-access",
    "no-cross-tenant-access",
    "fail-closed-unknown-scope"
  ],
  "validators": [
    "tenant-profile-validator",
    "no-cross-tenant-scope-validator",
    "no-cross-area-scope-validator",
    "skill-scope-compatibility-validator",
    "tool-scope-compatibility-validator",
    "memory-scope-validator",
    "knowledge-scope-validator",
    "user-permission-validator",
    "admin-action-validator"
  ],
  "ui_profile": {
    "logo_path": "assets/images/liquisto/liquisto_logo.png",
    "experience_standard": "sota-2026-tenant-crm",
    "brand_assets": {
      "logo_path": "assets/images/liquisto/liquisto_logo.png",
      "favicon_path": null,
      "app_icon_path": null,
      "asset_scope": "tenant-owned"
    },
    "landing": {
      "type": "internal-operations-dashboard",
      "area_presentation": "tiles"
    },
    "navigation": {
      "primary_area_ids": [
        "research"
      ],
      "admin_area_ids": [
        "tenant-admin"
      ]
    },
    "command_center": {
      "enabled": true,
      "surfaces": [
        "global-search",
        "quick-actions",
        "notifications",
        "saved-views",
        "scas-actions"
      ],
      "default_route": "/"
    },
    "scas_skill_packs": [
      {
        "id": "liquisto-research-assistance",
        "task_types": [
          "tenant-research",
          "document-synthesis"
        ],
        "required_capabilities": [
          "research"
        ],
        "status": "planned"
      }
    ],
    "terminology": {
      "customer": "Customer",
      "case": "Case",
      "task": "Task",
      "email": "Email",
      "cockpit": "Cockpit"
    },
    "workspace_areas": [
      {
        "id": "research",
        "display_name": "Research",
        "description": "Tenant-scoped research workspace backed by role-derived data-source grants.",
        "route": "/research",
        "required_capability": "research",
        "admin_only": false,
        "status": "active"
      },
      {
        "id": "tenant-admin",
        "display_name": "Admin Dashboard",
        "description": "Tenant administration for users, roles, settings, and launch governance.",
        "route": "/admin",
        "required_capability": "tenant-admin",
        "admin_only": true,
        "status": "active"
      }
    ]
  }
}
